begin,end,id,text,prep_verbal,prep_read
1580.746,1584.116,R006-S01-T003-U000552,보통 생각하시면맑은 국물이라고 생각하시는데,보통 생각하시면맑은 국물이라고 생각하시는데,보통 생각하시면맑은 국물이라고 생각하시는데
1584.183,1586.151,R006-S01-T003-U000553,(사장3) 저희는 빨간 양곰탕이라서,저희는 빨간 양곰탕이라서,사장 저희는 빨간 양곰탕이라서
1586.218,1589.154,R006-S01-T003-U000554,"30, 40대 직장인 남성분들이정말 좋아하세요",", 대 직장인 남성분들이정말 좋아하세요",", 대 직장인 남성분들이정말 좋아하세요"
1589.221,1590.456,R006-S01-T003-U000555,"(연지) 어, 네[사장3의 호응]","어 , 네","연지 어 , 네 사장의 호응"
1591.323,1592.658,R006-S01-T003-U000556,[경쾌한 음악이 계속된다],,경쾌한 음악이 계속된다
1594.56,1596.662,R006-S01-T003-U000557,(수영) 냄새가술 먹은 다음 날 맡으면,냄새가술 먹은 다음 날 맡으면,수영 냄새가술 먹은 다음 날 맡으면
1596.728,1597.896,R006-S01-T003-U000558,- (수영) 약간 눈…- (사장3) 아주 1등입니다,약간 눈 아주 등입니다,수영 약간 눈 사장 아주 등입니다
1597.963,1599.665,R006-S01-T003-U000559,"- (수영) 예, 1등이네, 이거- (사장3) 네","예 , 등이네 , 이거 네","수영 예 , 등이네 , 이거 사장 네"
1599.731,1601.667,R006-S01-T003-U000560,"[리드미컬한 음악](수영) 야, 이 집, 기가 막히네","야 , 이 집 , 기가 막히네","리드미컬한 음악 수영 야 , 이 집 , 기가 막히네"
1601.733,1603.268,R006-S01-T003-U000561,"이 집 주력이겠다, 이거","이 집 주력이겠다 , 이거","이 집 주력이겠다 , 이거"
1606.004,1609.475,R006-S01-T003-U000562,(규환) 양곰탕은공정이 굉장히 까다롭습니다,양곰탕은공정이 굉장히 까다롭습니다,규환 양곰탕은공정이 굉장히 까다롭습니다
1609.541,1613.545,R006-S01-T003-U000563,(규환) 첫 번째로내장을 먼저 삶아야 하고,첫 번째로내장을 먼저 삶아야 하고,규환 첫 번째로내장을 먼저 삶아야 하고
1614.213,1618.65,R006-S01-T003-U000564,다진 양념은 두태 기름이라는부위를 쓰고 있어요,다진 양념은 두태 기름이라는부위를 쓰고 있어요,다진 양념은 두태 기름이라는부위를 쓰고 있어요
1618.951,1620.486,R006-S01-T003-U000565,(규환) 소기름을 추출을 하고,소기름을 추출을 하고,규환 소기름을 추출을 하고
1621.92,1624.389,R006-S01-T003-U000566,"(규환) 고춧가루그다음에 뭐, 소금, 후추","고춧가루그다음에 뭐 , 소금 , 후추","규환 고춧가루그다음에 뭐 , 소금 , 후추"
1624.456,1628.494,R006-S01-T003-U000567,일반 양념을 넣고되게 만들어 낸 다진 양념입니다,일반 양념을 넣고되게 만들어 낸 다진 양념입니다,일반 양념을 넣고되게 만들어 낸 다진 양념입니다
1630.929,1633.365,R006-S01-T003-U000568,(규환) 내장이 들어가서맑게 끓이는 탕 중에,내장이 들어가서맑게 끓이는 탕 중에,규환 내장이 들어가서맑게 끓이는 탕 중에
1633.432,1635.2,R006-S01-T003-U000569,나주 곰탕 스타일이 있는데,나주 곰탕 스타일이 있는데,나주 곰탕 스타일이 있는데
1635.267,1638.303,R006-S01-T003-U000570,(규환) 저희 탕은 좀 구수하고얼큰하게 드시는 탕이고,저희 탕은 좀 구수하고얼큰하게 드시는 탕이고,규환 저희 탕은 좀 구수하고얼큰하게 드시는 탕이고
1645.143,1646.378,R006-S01-T003-U000571,[리드미컬한 음악이 계속된다],,리드미컬한 음악이 계속된다
1657.256,1659.925,R006-S01-T003-U000572,(영만) 이 내장탕이 아주 빨갛네,이 내장탕이 아주 빨갛네,영만 이 내장탕이 아주 빨갛네
1662.06,1664.363,R006-S01-T003-U000573,[개운한 탄성과 목기침],,개운한 탄성과 목기침
1664.429,1665.697,R006-S01-T003-U000574,"[연지의 웃음](수영) 어, 선생님 그렇게맛있게 드실 거예요","어 , 선생님 그렇게맛있게 드실 거예요","연지의 웃음 수영 어 , 선생님 그렇게맛있게 드실 거예요"
1665.764,1666.765,R006-S01-T003-U000575,"얼큰해, 얼큰해","얼큰해 , 얼큰해","얼큰해 , 얼큰해"
1667.232,1668.901,R006-S01-T003-U000576,[영만의 개운한 탄성][후루룩 소리가 들린다],,영만의 개운한 탄성 후루룩 소리가 들린다
1668.967,1670.736,R006-S01-T003-U000577,"- 어유, 국물 참 좋다, 응- (수영) 그렇죠?[아삭아삭 씹는 소리가 들린다]","어유 , 국물 참 좋다 , 응 그렇죠 ?","어유 , 국물 참 좋다 , 응 수영 그렇죠 ? 아삭아삭 씹는 소리가 들린다"
1670.802,1672.371,R006-S01-T003-U000578,"(영만) 이건 뭐예요, 이건?","이건 뭐예요 , 이건 ?","영만 이건 뭐예요 , 이건 ?"
1672.437,1673.805,R006-S01-T003-U000579,[흥미로운 음악]이거 양,이거 양,흥미로운 음악 이거 양
1674.239,1675.24,R006-S01-T003-U000580,첫 번째 위,첫 번째 위,첫 번째 위
1675.307,1677.576,R006-S01-T003-U000581,(영만과 수영)- 응? 어떤 게 첫 번째 위야?- 이거 첫 번째 위,응 ? 어떤 게 첫 번째 위야 ? 이거 첫 번째 위,영만과 수영 응 ? 어떤 게 첫 번째 위야 ? 이거 첫 번째 위
1677.643,1678.644,R006-S01-T003-U000582,이건 저도 모르겠다,이건 저도 모르겠다,이건 저도 모르겠다
1679.278,1681.446,R006-S01-T003-U000583,"사장님, 이거 부위 좀알려 주실 수 있어요?","사장님 , 이거 부위 좀알려 주실 수 있어요 ?","사장님 , 이거 부위 좀알려 주실 수 있어요 ?"
1682.948,1684.816,R006-S01-T003-U000584,(사장3) 여기에 들어간 내장은,여기에 들어간 내장은,사장 여기에 들어간 내장은
1684.883,1687.753,R006-S01-T003-U000585,"홍창, 곱창, 이제 양","홍창 , 곱창 , 이제 양","홍창 , 곱창 , 이제 양"
1688.22,1690.255,R006-S01-T003-U000586,(사장3) 이렇게 3가지가 이제조합적으로 들어갑니다,이렇게 가지가 이제조합적으로 들어갑니다,사장 이렇게 가지가 이제조합적으로 들어갑니다
1690.322,1691.69,R006-S01-T003-U000587,"- (수영) 홍창, 곱창, 양?- (사장3) 네","홍창 , 곱창 , 양 ? 네","수영 홍창 , 곱창 , 양 ? 사장 네"
1691.757,1693.625,R006-S01-T003-U000588,[고상한 음악],,고상한 음악
1693.892,1694.993,R006-S01-T003-U000589,"(수영) 아, 맛있어요","아 , 맛있어요","수영 아 , 맛있어요"
1697.529,1700.065,R006-S01-T003-U000590,"(수영) 노른자에 육수를 섞어서이야, 이거 맛있겠다","노른자에 육수를 섞어서이야 , 이거 맛있겠다","수영 노른자에 육수를 섞어서이야 , 이거 맛있겠다"
1700.232,1701.233,R006-S01-T003-U000591,[영만의 개운한 숨소리],,영만의 개운한 숨소리
1703.502,1704.87,R006-S01-T003-U000592,[개운한 숨소리](영만) 괜찮아요?[연지의 음미하는 콧소리],괜찮아요 ?,개운한 숨소리 영만 괜찮아요 ? 연지의 음미하는 콧소리
1707.039,1709.274,R006-S01-T003-U000593,[제작진과 수영의 웃음],,제작진과 수영의 웃음
1710.409,1711.41,R006-S01-T003-U000594,(수영) [웃으며] 오늘 참으십니까?,오늘 참으십니까 ?,수영 웃으며 오늘 참으십니까 ?
1711.476,1712.477,R006-S01-T003-U000595,[수영의 개운한 탄성],,수영의 개운한 탄성
1712.544,1715.681,R006-S01-T003-U000596,(영만) 오랜만에 정말입에 쫙쫙 붙는 거 먹는다,오랜만에 정말입에 쫙쫙 붙는 거 먹는다,영만 오랜만에 정말입에 쫙쫙 붙는 거 먹는다
1715.747,1718.45,R006-S01-T003-U000597,선수가 만들었어요입에 쫙 붙어요[연지의 호응],선수가 만들었어요입에 쫙 붙어요,선수가 만들었어요입에 쫙 붙어요 연지의 호응
1718.517,1719.985,R006-S01-T003-U000598,[경쾌한 음악],,경쾌한 음악
1724.99,1727.292,R006-S01-T003-U000599,(영만) 몸하고 손하고따로 놀고 있어,몸하고 손하고따로 놀고 있어,영만 몸하고 손하고따로 놀고 있어
1727.359,1730.228,R006-S01-T003-U000600,"(영만) 머리 쪽은 '야, 그만 먹어그만 먹어' 하는데[수영의 웃음]","머리 쪽은 야 , 그만 먹어그만 먹어 하는데","영만 머리 쪽은 야 , 그만 먹어그만 먹어 하는데 수영의 웃음"
1730.629,1732.23,R006-S01-T003-U000601,(영만) 기계적으로 손이 자꾸…,기계적으로 손이 자꾸,영만 기계적으로 손이 자꾸
1737.369,1739.738,R006-S01-T003-U000602,- (연지) 왜요?- (수영) 왜요? 숭늉 드셔야죠[익살스러운 음악],왜요 ? 왜요 ? 숭늉 드셔야죠,연지 왜요 ? 수영 왜요 ? 숭늉 드셔야죠 익살스러운 음악
1742.941,1744.276,R006-S01-T003-U000603,[식기를 달그락거린다],,식기를 달그락거린다
1744.343,1746.178,R006-S01-T003-U000604,(영만) 시작하면 다 먹게 된다고[연지의 웃음],시작하면 다 먹게 된다고,영만 시작하면 다 먹게 된다고 연지의 웃음
1747.279,1749.348,R006-S01-T003-U000605,(수영) 양평 해장국 같기도 한데아니고[영만의 개운한 숨소리],양평 해장국 같기도 한데아니고,수영 양평 해장국 같기도 한데아니고 영만의 개운한 숨소리
1749.414,1750.983,R006-S01-T003-U000606,육개장 같기도 한데 좀 다르고,육개장 같기도 한데 좀 다르고,육개장 같기도 한데 좀 다르고
1751.249,1753.418,R006-S01-T003-U000607,"이건 이거만의길이 있는데요, 선생님[연지가 맞장구친다]","이건 이거만의길이 있는데요 , 선생님","이건 이거만의길이 있는데요 , 선생님 연지가 맞장구친다"
1753.485,1755.354,R006-S01-T003-U000608,[잔잔한 음악](연지) 전체적으로굉장히 트렌디한,전체적으로굉장히 트렌디한,잔잔한 음악 연지 전체적으로굉장히 트렌디한
1755.42,1757.055,R006-S01-T003-U000609,방식으로 다 하셨네요,방식으로 다 하셨네요,방식으로 다 하셨네요
1757.122,1759.658,R006-S01-T003-U000610,이 음식하는 것도[목기침][수영과 연지의 호응],이 음식하는 것도,이 음식하는 것도 목기침 수영과 연지의 호응
1760.425,1763.996,R006-S01-T003-U000611,"그 셰프들이 한발 먼저가야 할 것 같아, 남들보다","그 셰프들이 한발 먼저가야 할 것 같아 , 남들보다","그 셰프들이 한발 먼저가야 할 것 같아 , 남들보다"
1765.264,1766.264,R006-S01-T003-U000612,(영만) 자!,자 !,영만 자 !
1767.132,1770.202,R006-S01-T003-U000613,- (연지) 넷플릭스- (수영) ♪ 다단 ♪[함께 웃는다],넷플릭스 다단,연지 넷플릭스 수영 다단 함께 웃는다
1776.041,1777.476,R006-S01-T003-U000614,[영만과 수영의 웃음],,영만과 수영의 웃음
1777.643,1779.845,R006-S01-T003-U000615,(영만) 어제 술 좀 한 것 같아[연지의 웃음],어제 술 좀 한 것 같아,영만 어제 술 좀 한 것 같아 연지의 웃음
1780.646,1782.08,R006-S01-T003-U000616,[흥미로운 음악],,흥미로운 음악
1783.582,1784.583,R006-S01-T003-U000617,(수영) 우리나라는,우리나라는,수영 우리나라는
1784.65,1786.051,R006-S01-T003-U000618,다른 나라는 이제 고기를,다른 나라는 이제 고기를,다른 나라는 이제 고기를
1786.118,1789.621,R006-S01-T003-U000619,그 육수에다가 이렇게담가서 이렇게 먹고,그 육수에다가 이렇게담가서 이렇게 먹고,그 육수에다가 이렇게담가서 이렇게 먹고
1789.688,1792.658,R006-S01-T003-U000620,"훠궈나 왜전골, 뭐, 샤부샤부","훠궈나 왜전골 , 뭐 , 샤부샤부","훠궈나 왜전골 , 뭐 , 샤부샤부"
1792.724,1794.993,R006-S01-T003-U000621,그런 것들이 발달했는데우리는 그렇지 않아,그런 것들이 발달했는데우리는 그렇지 않아,그런 것들이 발달했는데우리는 그렇지 않아
1795.06,1796.862,R006-S01-T003-U000622,다 때려 넣고 국물을 만들어요,다 때려 넣고 국물을 만들어요,다 때려 넣고 국물을 만들어요
1797.329,1799.665,R006-S01-T003-U000623,(수영) 육수를 만들어서국물부터 떠먹죠,육수를 만들어서국물부터 떠먹죠,수영 육수를 만들어서국물부터 떠먹죠
1799.731,1801.066,R006-S01-T003-U000624,전골을 만들죠,전골을 만들죠,전골을 만들죠
1801.133,1803.235,R006-S01-T003-U000625,(수영) 고기를 똑같이물에 익혀 먹어도,고기를 똑같이물에 익혀 먹어도,수영 고기를 똑같이물에 익혀 먹어도
1803.302,1805.07,R006-S01-T003-U000626,고기를 즐기는 나라가 있지만,고기를 즐기는 나라가 있지만,고기를 즐기는 나라가 있지만
1805.137,1806.805,R006-S01-T003-U000627,우리는 그 국물을 즐기죠,우리는 그 국물을 즐기죠,우리는 그 국물을 즐기죠
1810.942,1813.578,R006-S01-T003-U000628,(연지) 근데 이 앞에 보면코스 메뉴가 있어요,근데 이 앞에 보면코스 메뉴가 있어요,연지 근데 이 앞에 보면코스 메뉴가 있어요
1813.645,1814.646,R006-S01-T003-U000629,(영만) 코스?,코스 ?,영만 코스 ?
1814.713,1817.215,R006-S01-T003-U000630,"(수영) 야, 만두전골의 코스는처음 봐요","야 , 만두전골의 코스는처음 봐요","수영 야 , 만두전골의 코스는처음 봐요"
1817.282,1820.385,R006-S01-T003-U000631,(혜경) 안녕하세요[저마다 인사한다],안녕하세요,혜경 안녕하세요 저마다 인사한다
1820.452,1823.789,R006-S01-T003-U000632,이런 만두 코스 요리는처음 보는데[혜경의 웃음],이런 만두 코스 요리는처음 보는데,이런 만두 코스 요리는처음 보는데 혜경의 웃음
1823.855,1825.791,R006-S01-T003-U000633,만두를 드신다고 해서,만두를 드신다고 해서,만두를 드신다고 해서
1825.857,1828.226,R006-S01-T003-U000634,[잔잔한 음악](혜경) 그냥 만두 한 그릇만드시는 건 아니잖아요,그냥 만두 한 그릇만드시는 건 아니잖아요,잔잔한 음악 혜경 그냥 만두 한 그릇만드시는 건 아니잖아요
1828.293,1831.263,R006-S01-T003-U000635,전에는 이렇게 쫙 깔아서한 상을 차렸는데,전에는 이렇게 쫙 깔아서한 상을 차렸는데,전에는 이렇게 쫙 깔아서한 상을 차렸는데
1831.33,1834.499,R006-S01-T003-U000636,(혜경) 지금은 그렇게 한 상으로차려서 드시는 건 아니고,지금은 그렇게 한 상으로차려서 드시는 건 아니고,혜경 지금은 그렇게 한 상으로차려서 드시는 건 아니고
1834.566,1838.336,R006-S01-T003-U000637,가짓수는 조금 있지만순서대로 해 드리는 거죠,가짓수는 조금 있지만순서대로 해 드리는 거죠,가짓수는 조금 있지만순서대로 해 드리는 거죠
1841.406,1844.81,R006-S01-T003-U000638,(혜경) 고기를 안 넣고채소만 넣은 소만두입니다,고기를 안 넣고채소만 넣은 소만두입니다,혜경 고기를 안 넣고채소만 넣은 소만두입니다
1845.21,1847.045,R006-S01-T003-U000639,(영만) 나이팅게일의모자 같지 않아?,나이팅게일의모자 같지 않아 ?,영만 나이팅게일의모자 같지 않아 ?
1847.112,1848.513,R006-S01-T003-U000640,"(연지) 음, 정말요[수영의 깨달은 탄성][영만의 웃음]","음 , 정말요","연지 음 , 정말요 수영의 깨달은 탄성 영만의 웃음"
1852.25,1855.187,R006-S01-T003-U000641,"[수영의 음미하는 콧소리](수영) 이야, 고기가 하나도안 들어갔는데 이렇게 맛있네요","이야 , 고기가 하나도안 들어갔는데 이렇게 맛있네요","수영의 음미하는 콧소리 수영 이야 , 고기가 하나도안 들어갔는데 이렇게 맛있네요"
1855.253,1856.354,R006-S01-T003-U000642,(영만) 오이가 들어갔네[아삭 씹는 소리가 들린다],오이가 들어갔네,영만 오이가 들어갔네 아삭 씹는 소리가 들린다
