begin,end,id,text,prep_verbal,prep_read
908.107,910.777,R006-S01-T001-U000334,"(용진) 그, 우리 어머니할머니들이 이제 그 고생을 하면서","그 , 우리 어머니할머니들이 이제 그 고생을 하면서","용진 그 , 우리 어머니할머니들이 이제 그 고생을 하면서"
910.843,912.512,R006-S01-T001-U000335,애들 밥을 먹인 거예요[용진의 웃음],애들 밥을 먹인 거예요,애들 밥을 먹인 거예요 용진의 웃음
912.578,914.614,R006-S01-T001-U000336,"계속 눈물이 나요, 서 있는데[영만과 용진의 호응]","계속 눈물이 나요 , 서 있는데","계속 눈물이 나요 , 서 있는데 영만과 용진의 호응"
914.68,917.583,R006-S01-T001-U000337,"[연지의 웃음](수영) 슬프지 않은데눈물이 계속, 지금","슬프지 않은데눈물이 계속 , 지금","연지의 웃음 수영 슬프지 않은데눈물이 계속 , 지금"
917.65,918.851,R006-S01-T001-U000338,(용진) 왜 감격하고 그러실까[연지의 웃음],왜 감격하고 그러실까,용진 왜 감격하고 그러실까 연지의 웃음
918.918,920.887,R006-S01-T001-U000339,"[연지와 용진의 웃음](수영) 눈물이 나 가지고아, 이게 너무…","눈물이 나 가지고아 , 이게 너무","연지와 용진의 웃음 수영 눈물이 나 가지고아 , 이게 너무"
920.953,922.722,R006-S01-T001-U000340,(영만) 지금 뭐 준비하고계신 거예요?[용진의 탄성],지금 뭐 준비하고계신 거예요 ?,영만 지금 뭐 준비하고계신 거예요 ? 용진의 탄성
922.789,924.857,R006-S01-T001-U000341,(용진) 제주도는 어쨌든손님맞이하면,제주도는 어쨌든손님맞이하면,용진 제주도는 어쨌든손님맞이하면
924.924,927.059,R006-S01-T001-U000342,"저, 잔치를 하든, 뭐, 상이 나든","저 , 잔치를 하든 , 뭐 , 상이 나든","저 , 잔치를 하든 , 뭐 , 상이 나든"
927.126,929.562,R006-S01-T001-U000343,(용진) 무슨 집안의 관혼상제무슨 일이 있을 때마다,무슨 집안의 관혼상제무슨 일이 있을 때마다,용진 무슨 집안의 관혼상제무슨 일이 있을 때마다
929.629,931.931,R006-S01-T001-U000344,돼지를 먼저 삶는 게제일 우선이거든요[영만과 수영의 호응],돼지를 먼저 삶는 게제일 우선이거든요,돼지를 먼저 삶는 게제일 우선이거든요 영만과 수영의 호응
931.998,933.332,R006-S01-T001-U000345,[고상한 음악],,고상한 음악
933.533,934.7,R006-S01-T001-U000346,(용진) 결혼식을 예로 들면,결혼식을 예로 들면,용진 결혼식을 예로 들면
934.767,937.837,R006-S01-T001-U000347,한 집에서 네다섯 마리 정도돼지를 잡기도 했어요,한 집에서 네다섯 마리 정도돼지를 잡기도 했어요,한 집에서 네다섯 마리 정도돼지를 잡기도 했어요
938.671,941.274,R006-S01-T001-U000348,(용진) 돼지를 잡게 되면제주도에서는 전통적으로,돼지를 잡게 되면제주도에서는 전통적으로,용진 돼지를 잡게 되면제주도에서는 전통적으로
941.34,944.61,R006-S01-T001-U000349,열두 부분으로 이제 해체가 돼요,열두 부분으로 이제 해체가 돼요,열두 부분으로 이제 해체가 돼요
944.677,947.38,R006-S01-T001-U000350,(용진) 대가리부터 그다음에'휘양도레기'라고 해서 목살,대가리부터 그다음에휘양도레기라고 해서 목살,용진 대가리부터 그다음에휘양도레기라고 해서 목살
947.447,949.816,R006-S01-T001-U000351,"뭐, '일룬', 뒤쪽은 '비피'","뭐 , 일룬 , 뒤쪽은 비피","뭐 , 일룬 , 뒤쪽은 비피"
949.882,953.085,R006-S01-T001-U000352,"뭐, 그다음에 뭐'갈리'라고 그래서 갈비가 나오고","뭐 , 그다음에 뭐갈리라고 그래서 갈비가 나오고","뭐 , 그다음에 뭐갈리라고 그래서 갈비가 나오고"
953.352,956.122,R006-S01-T001-U000353,(용진) 그다음에 이 가슴이게 지금 '삼겹살'이라고 하는 것,그다음에 이 가슴이게 지금 삼겹살이라고 하는 것,용진 그다음에 이 가슴이게 지금 삼겹살이라고 하는 것
956.189,958.758,R006-S01-T001-U000354,"(용진) 그 '접짝뼈'라고 해서여기 1, 2, 3번 갈비 나오고","그 접짝뼈라고 해서여기 , , 번 갈비 나오고","용진 그 접짝뼈라고 해서여기 , , 번 갈비 나오고"
958.825,960.026,R006-S01-T001-U000355,[아궁이 장작 타는 소리],,아궁이 장작 타는 소리
962.195,964.03,R006-S01-T001-U000356,(용진) 그러면 하루 종일삶아야 하는 거죠,그러면 하루 종일삶아야 하는 거죠,용진 그러면 하루 종일삶아야 하는 거죠
964.096,967.066,R006-S01-T001-U000357,순대 같은 것도 다 삶아내요내장 같은 것 다 삶아내고,순대 같은 것도 다 삶아내요내장 같은 것 다 삶아내고,순대 같은 것도 다 삶아내요내장 같은 것 다 삶아내고
970.102,971.871,R006-S01-T001-U000358,"그걸 며칠씩 하잖아요, 제주도는","그걸 며칠씩 하잖아요 , 제주도는","그걸 며칠씩 하잖아요 , 제주도는"
971.938,973.84,R006-S01-T001-U000359,(용진) 원래는 '일뤠잔치'라고그래 가지고,원래는 일뤠잔치라고그래 가지고,용진 원래는 일뤠잔치라고그래 가지고
974.24,976.342,R006-S01-T001-U000360,맨 처음에는 마을 아낙들끼리모여서,맨 처음에는 마을 아낙들끼리모여서,맨 처음에는 마을 아낙들끼리모여서
976.409,978.377,R006-S01-T001-U000361,이불 꿰매는 거부터 시작해요[잔잔한 음악],이불 꿰매는 거부터 시작해요,이불 꿰매는 거부터 시작해요 잔잔한 음악
978.444,980.613,R006-S01-T001-U000362,[연지의 호응](용진) 그리고 이제 자기가갖고 있는 콩들 모아서,그리고 이제 자기가갖고 있는 콩들 모아서,연지의 호응 용진 그리고 이제 자기가갖고 있는 콩들 모아서
980.98,982.181,R006-S01-T001-U000363,두부 만들기를 하고,두부 만들기를 하고,두부 만들기를 하고
985.518,987.72,R006-S01-T001-U000364,(수영) 잔치가 좋아서일주일 하는 게 아니고,잔치가 좋아서일주일 하는 게 아니고,수영 잔치가 좋아서일주일 하는 게 아니고
987.787,989.388,R006-S01-T001-U000365,"- (수영) 일주일이 필요하네요- (용진) 네, 필요하죠[영만의 웃음]","일주일이 필요하네요 네 , 필요하죠","수영 일주일이 필요하네요 용진 네 , 필요하죠 영만의 웃음"
989.455,991.49,R006-S01-T001-U000366,- (수영) 준비하려면- (용진) 결혼식 한 사흘 전에,준비하려면 결혼식 한 사흘 전에,수영 준비하려면 용진 결혼식 한 사흘 전에
991.557,994.093,R006-S01-T001-U000367,"(용진) 돗 잡는 날, 그날부터본격적인 잔치가 되는 거죠[영만의 탄성]","돗 잡는 날 , 그날부터본격적인 잔치가 되는 거죠","용진 돗 잡는 날 , 그날부터본격적인 잔치가 되는 거죠 영만의 탄성"
994.16,995.394,R006-S01-T001-U000368,[정겨운 음악],,정겨운 음악
995.995,998.431,R006-S01-T001-U000369,(용진) 돼지를 삶아서 뜨거울 때바로 그냥,돼지를 삶아서 뜨거울 때바로 그냥,용진 돼지를 삶아서 뜨거울 때바로 그냥
998.497,1001.467,R006-S01-T001-U000370,도마 위에서 먹을 수 있는 게'돔베고기'라고 그래요[영만의 호응],도마 위에서 먹을 수 있는 게돔베고기라고 그래요,도마 위에서 먹을 수 있는 게돔베고기라고 그래요 영만의 호응
1001.534,1003.069,R006-S01-T001-U000371,[수영과 연지의 탄성],,수영과 연지의 탄성
1003.135,1004.237,R006-S01-T001-U000372,"(용진) 이거는, 예","이거는 , 예","용진 이거는 , 예"
1004.837,1005.938,R006-S01-T001-U000373,(용진) 두툼하게 해서,두툼하게 해서,용진 두툼하게 해서
1006.239,1008.875,R006-S01-T001-U000374,그러니까 고기가 생각보다뜨거울 때는 부드럽거든요,그러니까 고기가 생각보다뜨거울 때는 부드럽거든요,그러니까 고기가 생각보다뜨거울 때는 부드럽거든요
1009.108,1010.676,R006-S01-T001-U000375,(용진) 그래서 질기지 않습니다,그래서 질기지 않습니다,용진 그래서 질기지 않습니다
1010.743,1013.012,R006-S01-T001-U000376,(용진) 그래서 이렇게 해서드셔 보시고요[연지의 옅은 탄성],그래서 이렇게 해서드셔 보시고요,용진 그래서 이렇게 해서드셔 보시고요 연지의 옅은 탄성
1013.079,1015.214,R006-S01-T001-U000377,"(수영) 아, 현기증 나요써는 것 보니까, 빨리 먹고 싶어서[용진의 웃음]","아 , 현기증 나요써는 것 보니까 , 빨리 먹고 싶어서","수영 아 , 현기증 나요써는 것 보니까 , 빨리 먹고 싶어서 용진의 웃음"
1015.281,1016.449,R006-S01-T001-U000378,(연지) 너무 맛있겠다[용진과 수영의 웃음],너무 맛있겠다,연지 너무 맛있겠다 용진과 수영의 웃음
1016.515,1018.618,R006-S01-T001-U000379,(용진) 일단 하나씩 한번잡아 보실래요?,일단 하나씩 한번잡아 보실래요 ?,용진 일단 하나씩 한번잡아 보실래요 ?
1021.287,1022.922,R006-S01-T001-U000380,[유쾌한 음악],,유쾌한 음악
1024.09,1025.524,R006-S01-T001-U000381,[용진의 웃음],,용진의 웃음
1027.093,1028.094,R006-S01-T001-U000382,[연지의 신난 탄성],,연지의 신난 탄성
1030.029,1032.231,R006-S01-T001-U000383,"(용진) 음, 지금딱 좋을 때 오셨어[연지의 신난 탄성]","음 , 지금딱 좋을 때 오셨어","용진 음 , 지금딱 좋을 때 오셨어 연지의 신난 탄성"
1033.833,1034.867,R006-S01-T001-U000384,[용진의 웃음],,용진의 웃음
1036.168,1037.637,R006-S01-T001-U000385,(연지) 너무 촉촉하고[수영의 호응],너무 촉촉하고,연지 너무 촉촉하고 수영의 호응
1037.703,1039.038,R006-S01-T001-U000386,- (용진) 예- 촉촉해요,예 촉촉해요,용진 예 촉촉해요
1039.105,1041.374,R006-S01-T001-U000387,"(연지) 음, 보통 먹는돼지고기의 느낌이 아니에요","음 , 보통 먹는돼지고기의 느낌이 아니에요","연지 음 , 보통 먹는돼지고기의 느낌이 아니에요"
1043.175,1045.044,R006-S01-T001-U000388,"- (연지) 네, 그런 느낌- (수영) 엄청 비싼 집, 막[용진의 웃음]","네 , 그런 느낌 엄청 비싼 집 , 막","연지 네 , 그런 느낌 수영 엄청 비싼 집 , 막 용진의 웃음"
1045.111,1047.58,R006-S01-T001-U000389,볼프강 이런 데[용진의 웃음][경쾌한 음악],볼프강 이런 데,볼프강 이런 데 용진의 웃음 경쾌한 음악
1047.647,1049.015,R006-S01-T001-U000390,되게 맛있어[영만의 코 훌쩍이는 소리],되게 맛있어,되게 맛있어 영만의 코 훌쩍이는 소리
1049.448,1051.751,R006-S01-T001-U000391,(용진) 여기 이게 뼈'접짝뼈'라고 하는 것,여기 이게 뼈접짝뼈라고 하는 것,용진 여기 이게 뼈접짝뼈라고 하는 것
1052.051,1056.122,R006-S01-T001-U000392,(용진) 이건 원래 결혼식 때신부한테만 주는 고기예요,이건 원래 결혼식 때신부한테만 주는 고기예요,용진 이건 원래 결혼식 때신부한테만 주는 고기예요
1056.188,1058.424,R006-S01-T001-U000393,(영만) 원래 갈비에 붙은마지막 부분은 막,원래 갈비에 붙은마지막 부분은 막,영만 원래 갈비에 붙은마지막 부분은 막
1058.491,1060.092,R006-S01-T001-U000394,질기고 잘 안 떨어지는데,질기고 잘 안 떨어지는데,질기고 잘 안 떨어지는데
1060.159,1062.128,R006-S01-T001-U000395,"(용진과 영만)- 아, 이건 그렇지 않습니다- 이건 잘 떨어지네","아 , 이건 그렇지 않습니다 이건 잘 떨어지네","용진과 영만 아 , 이건 그렇지 않습니다 이건 잘 떨어지네"
1062.194,1064.196,R006-S01-T001-U000396,"- 와, 너무 부드러워요- (용진) 네[연지의 호응]","와 , 너무 부드러워요 네","와 , 너무 부드러워요 용진 네 연지의 호응"
1064.363,1066.599,R006-S01-T001-U000397,입에 들어가니까이게 부서지는 느낌이 아니고,입에 들어가니까이게 부서지는 느낌이 아니고,입에 들어가니까이게 부서지는 느낌이 아니고
1066.666,1069.035,R006-S01-T001-U000398,(수영) 녹아내리는 느낌이에요[연지의 호응][장작 타는 소리],녹아내리는 느낌이에요,수영 녹아내리는 느낌이에요 연지의 호응 장작 타는 소리
1069.101,1070.703,R006-S01-T001-U000399,[고상한 음악],,고상한 음악
1071.537,1075.608,R006-S01-T001-U000400,"(용진) 잔치 때 돼지 한두세 마리, 서너 마리 잡아도","잔치 때 돼지 한두세 마리 , 서너 마리 잡아도","용진 잔치 때 돼지 한두세 마리 , 서너 마리 잡아도"
1075.675,1077.076,R006-S01-T001-U000401,3일 동안 잔치를 하면서,일 동안 잔치를 하면서,일 동안 잔치를 하면서
1077.143,1079.779,R006-S01-T001-U000402,마을 사람들이 매일 그 집에 와서세 끼를 먹어야 해요,마을 사람들이 매일 그 집에 와서세 끼를 먹어야 해요,마을 사람들이 매일 그 집에 와서세 끼를 먹어야 해요
1079.979,1082.248,R006-S01-T001-U000403,(용진) 그러니까 몇백 명분의음식을 만들어야 하잖아요,그러니까 몇백 명분의음식을 만들어야 하잖아요,용진 그러니까 몇백 명분의음식을 만들어야 하잖아요
1082.315,1086.252,R006-S01-T001-U000404,(용진) 몇백 명이 먹으려면육수가 진하게 만들 수가 없잖아요,몇백 명이 먹으려면육수가 진하게 만들 수가 없잖아요,용진 몇백 명이 먹으려면육수가 진하게 만들 수가 없잖아요
1086.319,1088.821,R006-S01-T001-U000405,그러니까 이걸 넣어서양을 불리는 거예요[수영이 호응하며 말한다],그러니까 이걸 넣어서양을 불리는 거예요,그러니까 이걸 넣어서양을 불리는 거예요 수영이 호응하며 말한다
1088.888,1090.056,R006-S01-T001-U000406,[보글보글 끓는 소리],,보글보글 끓는 소리
1090.122,1092.024,R006-S01-T001-U000407,(용진) 돼지 수육을 삶아서나눠 먹기 위해서,돼지 수육을 삶아서나눠 먹기 위해서,용진 돼지 수육을 삶아서나눠 먹기 위해서
1092.091,1095.161,R006-S01-T001-U000408,돼지 수육을 삶은 국물에모자반이라는 해초를 넣어서,돼지 수육을 삶은 국물에모자반이라는 해초를 넣어서,돼지 수육을 삶은 국물에모자반이라는 해초를 넣어서
1095.227,1096.329,R006-S01-T001-U000409,양을 불리는 국이죠,양을 불리는 국이죠,양을 불리는 국이죠
1097.163,1098.864,R006-S01-T001-U000410,"(용진) 아, 몸국은 이제한 10분 정도만 끓이면","아 , 몸국은 이제한 분 정도만 끓이면","용진 아 , 몸국은 이제한 분 정도만 끓이면"
1098.931,1100.533,R006-S01-T001-U000411,한 번만 바르르 끓으면 돼요,한 번만 바르르 끓으면 돼요,한 번만 바르르 끓으면 돼요
1101.634,1103.002,R006-S01-T001-U000412,[용진의 신음][나뭇가지 부러지는 소리],,용진의 신음 나뭇가지 부러지는 소리
1103.502,1104.77,R006-S01-T001-U000413,[수영의 코 훌쩍이는 소리][잔잔한 음악],,수영의 코 훌쩍이는 소리 잔잔한 음악
1105.538,1106.839,R006-S01-T001-U000414,[나뭇가지 부러뜨리는 소리][수영의 힘주는 신음],,나뭇가지 부러뜨리는 소리 수영의 힘주는 신음
1108.14,1109.775,R006-S01-T001-U000415,(수영) 세 개는 너무 많아하나씩 하세요,세 개는 너무 많아하나씩 하세요,수영 세 개는 너무 많아하나씩 하세요
1109.842,1111.243,R006-S01-T001-U000416,[나뭇가지 부러뜨리는 소리],,나뭇가지 부러뜨리는 소리
1113.546,1115.181,R006-S01-T001-U000417,"- (영만) 그, 어디서 봤네- (용진) 한 점 드세요","그 , 어디서 봤네 한 점 드세요","영만 그 , 어디서 봤네 용진 한 점 드세요"
1115.247,1116.248,R006-S01-T001-U000418,(영만) 부채질하는 것,부채질하는 것,영만 부채질하는 것
