begin,end,id,text,prep_verbal,prep_read
2412.744,2415.546,R006-S01-T002-U000885,학생들부터 해서 이제어르신들까지 이렇게,학생들부터 해서 이제어르신들까지 이렇게,학생들부터 해서 이제어르신들까지 이렇게
2415.613,2416.914,R006-S01-T002-U000886,(호광) 가족 단위도 오고,가족 단위도 오고,호광 가족 단위도 오고
2416.981,2419.45,R006-S01-T002-U000887,"1대 오고 그다음에2대 오고, 3대 오고","대 오고 그다음에대 오고 , 대 오고","대 오고 그다음에대 오고 , 대 오고"
2419.517,2422.854,R006-S01-T002-U000888,(호광) 한때는 정말 저희가모임의 장소로,한때는 정말 저희가모임의 장소로,호광 한때는 정말 저희가모임의 장소로
2422.921,2424.555,R006-S01-T002-U000889,"50, 60명씩 막 예약해서",", 명씩 막 예약해서",", 명씩 막 예약해서"
2424.622,2426.991,R006-S01-T002-U000890,대학생들이 와서 많이 드셨죠,대학생들이 와서 많이 드셨죠,대학생들이 와서 많이 드셨죠
2429.127,2431.496,R006-S01-T002-U000891,"(수영과 호광)- 2개, 예- 아, 예, 2개 해 드릴게요","개 , 예 아 , 예 , 개 해 드릴게요","수영과 호광 개 , 예 아 , 예 , 개 해 드릴게요"
2431.562,2432.73,R006-S01-T002-U000892,전 세계의 쌀 요리 중에,전 세계의 쌀 요리 중에,전 세계의 쌀 요리 중에
2432.797,2435.366,R006-S01-T002-U000893,이렇게 감자탕의 볶음밥보다맛있는 게 난 별로 없는 것 같아요,이렇게 감자탕의 볶음밥보다맛있는 게 난 별로 없는 것 같아요,이렇게 감자탕의 볶음밥보다맛있는 게 난 별로 없는 것 같아요
2435.433,2437.235,R006-S01-T002-U000894,[흥미로운 음악](수영) 완벽한 볶음밥을만들어 봅시다,완벽한 볶음밥을만들어 봅시다,흥미로운 음악 수영 완벽한 볶음밥을만들어 봅시다
2437.302,2438.436,R006-S01-T002-U000895,퍼포먼스가 있어요,퍼포먼스가 있어요,퍼포먼스가 있어요
2439.437,2441.372,R006-S01-T002-U000896,(수영) 항상 요리는퍼포먼스가 중요해요,항상 요리는퍼포먼스가 중요해요,수영 항상 요리는퍼포먼스가 중요해요
2441.839,2443.875,R006-S01-T002-U000897,밥알의 마이야르 반응을일으키는 거지,밥알의 마이야르 반응을일으키는 거지,밥알의 마이야르 반응을일으키는 거지
2445.276,2446.644,R006-S01-T002-U000898,"(연지) 와, 너무 맛있겠다[식기 달그락거리는 소리]","와 , 너무 맛있겠다","연지 와 , 너무 맛있겠다 식기 달그락거리는 소리"
2446.711,2448.746,R006-S01-T002-U000899,(수영) 왜냐하면 이게우리가 먹을 때쯤 너무 붙거든,왜냐하면 이게우리가 먹을 때쯤 너무 붙거든,수영 왜냐하면 이게우리가 먹을 때쯤 너무 붙거든
2449.614,2450.915,R006-S01-T002-U000900,[연지의 탄성](수영) 내가 지금 뭘 하느냐?,내가 지금 뭘 하느냐 ?,연지의 탄성 수영 내가 지금 뭘 하느냐 ?
2451.349,2452.483,R006-S01-T002-U000901,"- (수영) 뭘 하느냐, 내가- (연지) 뭘 하느냐?","뭘 하느냐 , 내가 뭘 하느냐 ?","수영 뭘 하느냐 , 내가 연지 뭘 하느냐 ?"
2452.55,2453.918,R006-S01-T002-U000902,"(수영) 내가 뭘 하고 있겠어, 지금[냄비를 박박 긁는다]","내가 뭘 하고 있겠어 , 지금","수영 내가 뭘 하고 있겠어 , 지금 냄비를 박박 긁는다"
2453.985,2454.986,R006-S01-T002-U000903,(연지) 몰라요,몰라요,연지 몰라요
2455.053,2456.454,R006-S01-T002-U000904,요즘 대학교 앞에는이렇게 다 해 줘요,요즘 대학교 앞에는이렇게 다 해 줘요,요즘 대학교 앞에는이렇게 다 해 줘요
2456.521,2458.923,R006-S01-T002-U000905,(수영) 이렇게 해서잘 누룽지랑 섞어서[냄비를 박박 긁는다],이렇게 해서잘 누룽지랑 섞어서,수영 이렇게 해서잘 누룽지랑 섞어서 냄비를 박박 긁는다
2458.99,2460.758,R006-S01-T002-U000906,"- 하트로- (수영) 아, 그렇지, 하트[연지의 웃음]","하트로 아 , 그렇지 , 하트","하트로 수영 아 , 그렇지 , 하트 연지의 웃음"
2460.825,2462.193,R006-S01-T002-U000907,[연지와 수영의 웃음],,연지와 수영의 웃음
2463.594,2466.798,R006-S01-T002-U000908,(수영) 하트를 만들어야 해항상 이 볶음밥은 하트가 돼야지[연지의 웃음],하트를 만들어야 해항상 이 볶음밥은 하트가 돼야지,수영 하트를 만들어야 해항상 이 볶음밥은 하트가 돼야지 연지의 웃음
2466.864,2468.7,R006-S01-T002-U000909,"(영만과 수영)- 이제 먹어도 되는 거예요?- 네, 드세요","이제 먹어도 되는 거예요 ? 네 , 드세요","영만과 수영 이제 먹어도 되는 거예요 ? 네 , 드세요"
2468.766,2469.867,R006-S01-T002-U000910,[즐거운 음악],,즐거운 음악
2471.636,2472.637,R006-S01-T002-U000911,[수영의 탄성],,수영의 탄성
2472.704,2473.938,R006-S01-T002-U000912,맛있다,맛있다,맛있다
2474.939,2476.908,R006-S01-T002-U000913,"(수영과 연지)- 이러다 보면 다 먹는다니까요- 음, 맞아요","이러다 보면 다 먹는다니까요 음 , 맞아요","수영과 연지 이러다 보면 다 먹는다니까요 음 , 맞아요"
2476.974,2478.91,R006-S01-T002-U000914,(수영) 아무 생각 없이먹다 보면 다 먹고,아무 생각 없이먹다 보면 다 먹고,수영 아무 생각 없이먹다 보면 다 먹고
2478.977,2480.244,R006-S01-T002-U000915,(수영) 그렇지별거 아닌데 계속 들어가죠,그렇지별거 아닌데 계속 들어가죠,수영 그렇지별거 아닌데 계속 들어가죠
2480.311,2481.779,R006-S01-T002-U000916,- (연지) 맛있어요- (수영) 이게 맛있는 거예요,맛있어요 이게 맛있는 거예요,연지 맛있어요 수영 이게 맛있는 거예요
2481.846,2483.348,R006-S01-T002-U000917,(영만) 이것만 소주 3병 먹는다,이것만 소주 병 먹는다,영만 이것만 소주 병 먹는다
2483.414,2484.449,R006-S01-T002-U000918,[수영과 영만의 목기침],,수영과 영만의 목기침
2484.682,2485.683,R006-S01-T002-U000919,(수영) 더 드릴까요?,더 드릴까요 ?,수영 더 드릴까요 ?
2488.72,2490.321,R006-S01-T002-U000920,(수영) '이러면 안 되는데',이러면 안 되는데,수영 이러면 안 되는데
2490.788,2492.323,R006-S01-T002-U000921,[잔을 쟁그랑 부딪친다]- (연지) 짠- (수영) 짠,짠 짠,잔을 쟁그랑 부딪친다 연지 짠 수영 짠
2492.39,2493.725,R006-S01-T002-U000922,[부드러운 음악],,부드러운 음악
2494.892,2495.893,R006-S01-T002-U000923,[연지의 시원한 탄성],,연지의 시원한 탄성
2510.475,2512.076,R006-S01-T002-U000924,[경쾌한 음악],,경쾌한 음악
2512.143,2515.713,R006-S01-T002-U000925,(연지) 서울은 대한민국에서가장 발달한 도시고요,서울은 대한민국에서가장 발달한 도시고요,연지 서울은 대한민국에서가장 발달한 도시고요
2515.78,2519.45,R006-S01-T002-U000926,맛과 추억을 간직한 노포들이굉장히 많은 곳이잖아요,맛과 추억을 간직한 노포들이굉장히 많은 곳이잖아요,맛과 추억을 간직한 노포들이굉장히 많은 곳이잖아요
2519.517,2523.421,R006-S01-T002-U000927,이 노포들을 얘기할 때빼놓을 수 없는 음식이 바로 있죠,이 노포들을 얘기할 때빼놓을 수 없는 음식이 바로 있죠,이 노포들을 얘기할 때빼놓을 수 없는 음식이 바로 있죠
2523.488,2524.956,R006-S01-T002-U000928,바로 설렁탕,바로 설렁탕,바로 설렁탕
2526.023,2528.493,R006-S01-T002-U000929,"(수영) 와, 이쪽은 이렇게옛날인데, 선생님","와 , 이쪽은 이렇게옛날인데 , 선생님","수영 와 , 이쪽은 이렇게옛날인데 , 선생님"
2528.559,2531.262,R006-S01-T002-U000930,(수영) 이쪽은 또 엄청 현대식이고[연지와 영만의 호응][리드미컬한 음악],이쪽은 또 엄청 현대식이고,수영 이쪽은 또 엄청 현대식이고 연지와 영만의 호응 리드미컬한 음악
2532.263,2533.698,R006-S01-T002-U000931,[영만의 탄성][수영이 말한다],,영만의 탄성 수영이 말한다
2533.765,2535.266,R006-S01-T002-U000932,- (연지) 이쪽입니다- (수영) 여기인가 봐요,이쪽입니다 여기인가 봐요,연지 이쪽입니다 수영 여기인가 봐요
2535.333,2537.201,R006-S01-T002-U000933,"(영만) 왠지 이런 골목길에뭐, 숨은 집이 있다니까","왠지 이런 골목길에뭐 , 숨은 집이 있다니까","영만 왠지 이런 골목길에뭐 , 숨은 집이 있다니까"
2539.037,2540.104,R006-S01-T002-U000934,[수영의 탄성],,수영의 탄성
2540.304,2541.472,R006-S01-T002-U000935,(수영) 냄새가 아주 그냥…,냄새가 아주 그냥,수영 냄새가 아주 그냥
2541.539,2543.574,R006-S01-T002-U000936,"와, 여기 뚝배기가막 이렇게 있어요, 뚝배기","와 , 여기 뚝배기가막 이렇게 있어요 , 뚝배기","와 , 여기 뚝배기가막 이렇게 있어요 , 뚝배기"
2543.641,2545.309,R006-S01-T002-U000937,(영만) 뚝배기로 담을 쌓아 놨어재미있네[연지의 탄성],뚝배기로 담을 쌓아 놨어재미있네,영만 뚝배기로 담을 쌓아 놨어재미있네 연지의 탄성
2545.376,2546.377,R006-S01-T002-U000938,(수영) 뚝배기[영만의 목기침],뚝배기,수영 뚝배기 영만의 목기침
2546.444,2548.413,R006-S01-T002-U000939,"(수영) 오, 이 간판, 간판, 간판","오 , 이 간판 , 간판 , 간판","수영 오 , 이 간판 , 간판 , 간판"
2548.479,2550.581,R006-S01-T002-U000940,"[수영의 놀란 숨소리]선생님, 간판이 옛날식 간판","선생님 , 간판이 옛날식 간판","수영의 놀란 숨소리 선생님 , 간판이 옛날식 간판"
2550.648,2553.184,R006-S01-T002-U000941,"- (영만) 예, 안녕하세요- (수영) 안녕하세요","예 , 안녕하세요 안녕하세요","영만 예 , 안녕하세요 수영 안녕하세요"
2553.251,2554.552,R006-S01-T002-U000942,(수영) 부엌이 아궁이야,부엌이 아궁이야,수영 부엌이 아궁이야
2554.619,2557.722,R006-S01-T002-U000943,"[경쾌한 음악](연지) 와, 부엌 진짜 특이하다","와 , 부엌 진짜 특이하다","경쾌한 음악 연지 와 , 부엌 진짜 특이하다"
2557.789,2560.491,R006-S01-T002-U000944,"(수영) 와, 부엌이, 부엌이 아니고옛날 부뚜막 같은…","와 , 부엌이 , 부엌이 아니고옛날 부뚜막 같은","수영 와 , 부엌이 , 부엌이 아니고옛날 부뚜막 같은"
2565.43,2568.232,R006-S01-T002-U000945,"이건 낮고, 선생님, 이건 높아요왜 그런 거예요, 이건?[흥미로운 음악]","이건 낮고 , 선생님 , 이건 높아요왜 그런 거예요 , 이건 ?","이건 낮고 , 선생님 , 이건 높아요왜 그런 거예요 , 이건 ? 흥미로운 음악"
2568.299,2571.068,R006-S01-T002-U000946,"(영만) 어유, 낮다, 저쪽 책상보다","어유 , 낮다 , 저쪽 책상보다","영만 어유 , 낮다 , 저쪽 책상보다"
2571.135,2572.703,R006-S01-T002-U000947,요만큼 낮아[연지의 웃음],요만큼 낮아,요만큼 낮아 연지의 웃음
2573.371,2574.906,R006-S01-T002-U000948,"- (연지) [웃으며] 안 어울려요- (수영) 이만큼, 안 어울려","안 어울려요 이만큼 , 안 어울려","연지 웃으며 안 어울려요 수영 이만큼 , 안 어울려"
2576.674,2578.042,R006-S01-T002-U000949,(수영) 안녕하세요[저마다 인사한다],안녕하세요,수영 안녕하세요 저마다 인사한다
2578.109,2579.11,R006-S01-T002-U000950,"(영만) 예, 안녕하세요","예 , 안녕하세요","영만 예 , 안녕하세요"
2579.177,2580.445,R006-S01-T002-U000951,- (수영) 궁금한 게- 네,궁금한 게 네,수영 궁금한 게 네
2580.511,2582.413,R006-S01-T002-U000952,(수영) 이 테이블은이건 어린이용인가요?,이 테이블은이건 어린이용인가요 ?,수영 이 테이블은이건 어린이용인가요 ?
2582.48,2583.781,R006-S01-T002-U000953,"- (수영) 낮아요, 이건 높고?- (경호) 아","낮아요 , 이건 높고 ? 아","수영 낮아요 , 이건 높고 ? 경호 아"
2583.848,2586.484,R006-S01-T002-U000954,"(경호과 영만)- 이 밑에, 하나가 없어요- 여기 동그란 게 하나가 없어","이 밑에 , 하나가 없어요 여기 동그란 게 하나가 없어","경호과 영만 이 밑에 , 하나가 없어요 여기 동그란 게 하나가 없어"
2587.151,2589.22,R006-S01-T002-U000955,"(경호) 그 당시70년대, 80년대에는","그 당시년대 , 년대에는","경호 그 당시년대 , 년대에는"
2589.287,2591.622,R006-S01-T002-U000956,지금같이 이렇게덩치들이 안 컸답니다[수영의 깨달은 탄성],지금같이 이렇게덩치들이 안 컸답니다,지금같이 이렇게덩치들이 안 컸답니다 수영의 깨달은 탄성
2591.689,2593.09,R006-S01-T002-U000957,[잔잔한 음악](경호) 그 높이에 맞추신다고,그 높이에 맞추신다고,잔잔한 음악 경호 그 높이에 맞추신다고
2593.157,2594.859,R006-S01-T002-U000958,저쪽만 목수님이다 잘랐다고 그러더라고요,저쪽만 목수님이다 잘랐다고 그러더라고요,저쪽만 목수님이다 잘랐다고 그러더라고요
2594.926,2596.828,R006-S01-T002-U000959,[연지의 깨달은 탄성]그래서 저쪽은 조금 낮고,그래서 저쪽은 조금 낮고,연지의 깨달은 탄성 그래서 저쪽은 조금 낮고
2596.894,2598.896,R006-S01-T002-U000960,(수영과 경호)- 손님 키까지 배려했으니까- 그러니까요,손님 키까지 배려했으니까 그러니까요,수영과 경호 손님 키까지 배려했으니까 그러니까요
2598.963,2600.364,R006-S01-T002-U000961,어머니가 대단하시네요,어머니가 대단하시네요,어머니가 대단하시네요
2600.431,2601.966,R006-S01-T002-U000962,(수영) 그러니까오래 여기서 이렇게,그러니까오래 여기서 이렇게,수영 그러니까오래 여기서 이렇게
2602.033,2603.768,R006-S01-T002-U000963,장사를 하실 수 있지 않았나,장사를 하실 수 있지 않았나,장사를 하실 수 있지 않았나
2604.135,2605.937,R006-S01-T002-U000964,(수영) 그릇 닿는 곳만딱 이렇게 까진 게 되게,그릇 닿는 곳만딱 이렇게 까진 게 되게,수영 그릇 닿는 곳만딱 이렇게 까진 게 되게
2606.003,2607.472,R006-S01-T002-U000965,(경호) 뜨거운 그릇이닿는 데만 다 까졌어요,뜨거운 그릇이닿는 데만 다 까졌어요,경호 뜨거운 그릇이닿는 데만 다 까졌어요
2607.538,2608.906,R006-S01-T002-U000966,- (수영) 세월이 딱 느껴져요- (연지) 그렇네요[경호의 호응],세월이 딱 느껴져요 그렇네요,수영 세월이 딱 느껴져요 연지 그렇네요 경호의 호응
2609.34,2611.242,R006-S01-T002-U000967,이게 있으니까 더 좋아,이게 있으니까 더 좋아,이게 있으니까 더 좋아
2611.809,2614.579,R006-S01-T002-U000968,(영만과 수영)- 이 집 역사를 느낄 수 있고- 그게 참 전 좋은 것 같아요,이 집 역사를 느낄 수 있고 그게 참 전 좋은 것 같아요,영만과 수영 이 집 역사를 느낄 수 있고 그게 참 전 좋은 것 같아요
2614.645,2616.414,R006-S01-T002-U000969,(수영) 이런 분위기에서밥을 먹을 수 있는 경험이,이런 분위기에서밥을 먹을 수 있는 경험이,수영 이런 분위기에서밥을 먹을 수 있는 경험이
2616.481,2618.249,R006-S01-T002-U000970,"[부드러운 음악]거의 남지 않았거든요, 이제","거의 남지 않았거든요 , 이제","부드러운 음악 거의 남지 않았거든요 , 이제"
2627.525,2631.162,R006-S01-T002-U000971,(경호) 저희는 1972년도에저희 어머니께서,저희는 년도에저희 어머니께서,경호 저희는 년도에저희 어머니께서
2631.229,2634.198,R006-S01-T002-U000972,이 자리에서 설립을 하셨습니다,이 자리에서 설립을 하셨습니다,이 자리에서 설립을 하셨습니다
