begin,end,id,text,prep_verbal,prep_read
5.756,9.635,R258-S01-T001-U000001,[라디오가 지직거린다],,라디오가 지직거린다
10.636,12.804,R258-S01-T001-U000002,[라디오 채널이 돌아간다],,라디오 채널이 돌아간다
13.68,15.641,R258-S01-T001-U000003,"""NETFLIX 제공""",,
15.766,18.477,R258-S01-T001-U000004,[라디오 채널이 계속 돌아간다],,라디오 채널이 계속 돌아간다
18.894,20.062,R258-S01-T001-U000005,[라디오에서 음성이 흘러나온다],,라디오에서 음성이 흘러나온다
20.145,21.271,R258-S01-T001-U000006,[라디오 채널이 돌아간다],,라디오 채널이 돌아간다
21.355,22.606,R258-S01-T001-U000007,(라디오 속 남자1)팩스로 처리하도록...,팩스로 처리하도록 . . .,라디오 속 남자 팩스로 처리하도록 . . .
22.773,23.899,R258-S01-T001-U000008,[라디오 채널이 돌아간다],,라디오 채널이 돌아간다
23.982,27.027,R258-S01-T001-U000009,(라디오 속 리포터)전국이 대체로 맑겠고아침에는 안개...,전국이 대체로 맑겠고아침에는 안개 . . .,라디오 속 리포터 전국이 대체로 맑겠고아침에는 안개 . . .
28.111,30.155,R258-S01-T001-U000010,(라디오 속 아나운서1)57분 교통 정보입니다,분 교통 정보입니다,라디오 속 아나운서 분 교통 정보입니다
30.239,32.532,R258-S01-T001-U000011,출근길 절정에서 벗어나긴 했지만,출근길 절정에서 벗어나긴 했지만,출근길 절정에서 벗어나긴 했지만
32.616,34.701,R258-S01-T001-U000012,여전히 많이 밀리고 있습니다,여전히 많이 밀리고 있습니다,여전히 많이 밀리고 있습니다
34.785,38.538,R258-S01-T001-U000013,서울 외곽 순환 고속 도로하남에서 서울 하일 나들목 구간은[발소리가 난다],서울 외곽 순환 고속 도로하남에서 서울 하일 나들목 구간은,서울 외곽 순환 고속 도로하남에서 서울 하일 나들목 구간은 발소리가 난다
38.622,40.415,R258-S01-T001-U000014,하일 나들목 들어서는 부근에서,하일 나들목 들어서는 부근에서,하일 나들목 들어서는 부근에서
40.541,45.045,R258-S01-T001-U000015,[문발이 잘그락거린다]승용차 관련 사고까지 발생해서서하남부터 3킬로미터 정체고요,승용차 관련 사고까지 발생해서서하남부터 킬로미터 정체고요,문발이 잘그락거린다 승용차 관련 사고까지 발생해서서하남부터 킬로미터 정체고요
45.128,48.298,R258-S01-T001-U000016,이전 송파 나들목 부근 정체도늘어나는 상황입니다,이전 송파 나들목 부근 정체도늘어나는 상황입니다,이전 송파 나들목 부근 정체도늘어나는 상황입니다
48.382,50.008,R258-S01-T001-U000017,경부 고속 도로 서울 쪽으로 있던,경부 고속 도로 서울 쪽으로 있던,경부 고속 도로 서울 쪽으로 있던
50.092,53.011,R258-S01-T001-U000018,잠원 나들목 부근 추돌 사고는정리가 됐지만,잠원 나들목 부근 추돌 사고는정리가 됐지만,잠원 나들목 부근 추돌 사고는정리가 됐지만
53.095,56.723,R258-S01-T001-U000019,달래내 부근에서 반포 쪽 진행이더 어려워진 상태입니다,달래내 부근에서 반포 쪽 진행이더 어려워진 상태입니다,달래내 부근에서 반포 쪽 진행이더 어려워진 상태입니다
56.807,60.56,R258-S01-T001-U000020,강변 북로 마포 대교와 원효 대교 사이추돌 사고도 정리는 됐는데요,강변 북로 마포 대교와 원효 대교 사이추돌 사고도 정리는 됐는데요,강변 북로 마포 대교와 원효 대교 사이추돌 사고도 정리는 됐는데요
60.644,62.729,R258-S01-T001-U000021,정체가 가중된 상황이고요[미수의 힘주는 숨소리],정체가 가중된 상황이고요,정체가 가중된 상황이고요 미수의 힘주는 숨소리
62.813,65.857,R258-S01-T001-U000022,올림픽 대로 노량 대교에서반포 대교 쪽으로 가는 데[엔진음이 들려온다],올림픽 대로 노량 대교에서반포 대교 쪽으로 가는 데,올림픽 대로 노량 대교에서반포 대교 쪽으로 가는 데 엔진음이 들려온다
65.941,67.859,R258-S01-T001-U000023,30분 이상 걸리고 있습니다,분 이상 걸리고 있습니다,분 이상 걸리고 있습니다
67.943,69.653,R258-S01-T001-U000024,"다리 위에서는 성수 대교, 동호 대교","다리 위에서는 성수 대교 , 동호 대교","다리 위에서는 성수 대교 , 동호 대교"
69.736,72.698,R258-S01-T001-U000025,한남 대교 모두 양방향으로건너가기 어렵고요,한남 대교 모두 양방향으로건너가기 어렵고요,한남 대교 모두 양방향으로건너가기 어렵고요
72.781,75.826,R258-S01-T001-U000026,천호 대교는 이제강북 쪽으로 밀리기 시작했습니다,천호 대교는 이제강북 쪽으로 밀리기 시작했습니다,천호 대교는 이제강북 쪽으로 밀리기 시작했습니다
75.909,79.496,R258-S01-T001-U000027,강변 북로가 마포 대교에서한강 대교 쪽으로 속도 떨어지고[뚜껑을 달그락 닫는다],강변 북로가 마포 대교에서한강 대교 쪽으로 속도 떨어지고,강변 북로가 마포 대교에서한강 대교 쪽으로 속도 떨어지고 뚜껑을 달그락 닫는다
79.579,81.29,R258-S01-T001-U000028,동부 간선 도로 의정부 쪽으로는,동부 간선 도로 의정부 쪽으로는,동부 간선 도로 의정부 쪽으로는
81.373,83.625,R258-S01-T001-U000029,이화교 부근부터정체가 되고 있습니다,이화교 부근부터정체가 되고 있습니다,이화교 부근부터정체가 되고 있습니다
83.834,85.961,R258-S01-T001-U000030,[라디오에서 방송이 계속 흘러나온다],,라디오에서 방송이 계속 흘러나온다
86.044,87.713,R258-S01-T001-U000031,[문이 탁 여닫힌다][미수의 놀라는 숨소리],,문이 탁 여닫힌다 미수의 놀라는 숨소리
90.257,92.426,R258-S01-T001-U000032,아직 오픈을 안 했...,아직 오픈을 안 했 . . .,아직 오픈을 안 했 . . .
93.385,94.219,R258-S01-T001-U000033,[미수가 컵을 탁 내려놓는다],,미수가 컵을 탁 내려놓는다
94.303,96.138,R258-S01-T001-U000034,(미수)혹시 찾으시는 거 있으세요?,혹시 찾으시는 거 있으세요 ?,미수 혹시 찾으시는 거 있으세요 ?
97.514,100.35,R258-S01-T001-U000035,콩으로 만든 거 없나? 두부나...,콩으로 만든 거 없나 ? 두부나 . . .,콩으로 만든 거 없나 ? 두부나 . . .
102.477,106.231,R258-S01-T001-U000036,"(미수)그, 두유는 안 되나요?","그 , 두유는 안 되나요 ?","미수 그 , 두유는 안 되나요 ?"
106.398,107.524,R258-S01-T001-U000037,[한숨],,한숨
108.4,109.776,R258-S01-T001-U000038,[라디오에서 로고 송이 흘러나온다]그거라도 줘요,그거라도 줘요,라디오에서 로고 송이 흘러나온다 그거라도 줘요
111.32,112.362,R258-S01-T001-U000039,[미수의 한숨],,미수의 한숨
114.948,115.907,R258-S01-T001-U000040,[냉장고를 탁 연다],,냉장고를 탁 연다
116.366,118.827,R258-S01-T001-U000041,(라디오 속 아나운서2)잠시 후 9시를 알려드립니다,잠시 후 시를 알려드립니다,라디오 속 아나운서 잠시 후 시를 알려드립니다
121.121,124.124,R258-S01-T001-U000042,우유는 안 되겠죠?,우유는 안 되겠죠 ?,우유는 안 되겠죠 ?
124.207,125.834,R258-S01-T001-U000043,[라디오 속 정각 알림음],,라디오 속 정각 알림음
127.21,129.379,R258-S01-T001-U000044,[라디오에서 밝은 음악이 흘러나온다]콩이어야 되는데,콩이어야 되는데,라디오에서 밝은 음악이 흘러나온다 콩이어야 되는데
132.883,135.802,R258-S01-T001-U000045,저 위로 올라가면 슈퍼마켓이 있는데,저 위로 올라가면 슈퍼마켓이 있는데,저 위로 올라가면 슈퍼마켓이 있는데
138.096,143.018,R258-S01-T001-U000046,"(라디오 속 유열)방송, 사랑 그리고 비행기","방송 , 사랑 그리고 비행기","라디오 속 유열 방송 , 사랑 그리고 비행기"
143.101,145.771,R258-S01-T001-U000047,이 세 가지의 공통점이 뭔지 아세요?,이 세 가지의 공통점이 뭔지 아세요 ?,이 세 가지의 공통점이 뭔지 아세요 ?
146.897,150.901,R258-S01-T001-U000048,출발할 때 에너지가 가장 많이 든다,출발할 때 에너지가 가장 많이 든다,출발할 때 에너지가 가장 많이 든다
151.401,152.319,R258-S01-T001-U000049,안녕하세요,안녕하세요,안녕하세요
152.402,153.278,R258-S01-T001-U000050,(현우)기적이네,기적이네,현우 기적이네
153.362,157.324,R258-S01-T001-U000051,(라디오 속 유열)오늘부터 '음악앨범'의 진행을 맡은새로운 디제이 유열입니다,오늘부터 음악앨범의 진행을 맡은새로운 디제이 유열입니다,라디오 속 유열 오늘부터 음악앨범의 진행을 맡은새로운 디제이 유열입니다
157.699,161.203,R258-S01-T001-U000052,[새가 짹짹 지저귄다],,새가 짹짹 지저귄다
162.079,163.205,R258-S01-T001-U000053,[한숨],,한숨
163.288,165.082,R258-S01-T001-U000054,[잔잔한 음악],,잔잔한 음악
165.165,167.876,R258-S01-T001-U000055,(라디오 속 유열)땅에서 바퀴를 들어 올릴 때...,땅에서 바퀴를 들어 올릴 때 . . .,라디오 속 유열 땅에서 바퀴를 들어 올릴 때 . . .
171.713,174.007,R258-S01-T001-U000056,(라디오 속 유열)1994년 10월 1일 '유열의 음악앨범'...[은자가 열쇠를 잘그락 넣는다],년 월 일 유열의 음악앨범 . . .,라디오 속 유열 년 월 일 유열의 음악앨범 . . . 은자가 열쇠를 잘그락 넣는다
174.091,177.386,R258-S01-T001-U000057,"[라디오에서 방송이 계속 흘러나온다](은자)어? 유열, 디제이 바뀌었네?","어 ? 유열 , 디제이 바뀌었네 ?","라디오에서 방송이 계속 흘러나온다 은자 어 ? 유열 , 디제이 바뀌었네 ?"
178.095,179.429,R258-S01-T001-U000058,나 유열 완전 팬인데,나 유열 완전 팬인데,나 유열 완전 팬인데
179.513,181.598,R258-S01-T001-U000059,"(미수)언니, 아침 댓바람부터","언니 , 아침 댓바람부터","미수 언니 , 아침 댓바람부터"
181.681,184.226,R258-S01-T001-U000060,쟤가 두부 없냐고 하더니,쟤가 두부 없냐고 하더니,쟤가 두부 없냐고 하더니
184.309,185.143,R258-S01-T001-U000061,(은자)두부?,두부 ?,은자 두부 ?
185.477,186.853,R258-S01-T001-U000062,(미수)저기 들어갔어,저기 들어갔어,미수 저기 들어갔어
187.27,188.688,R258-S01-T001-U000063,(은자)갔다 온 거네,갔다 온 거네,은자 갔다 온 거네
189.189,190.107,R258-S01-T001-U000064,(미수)감방?,감방 ?,미수 감방 ?
190.607,192.025,R258-S01-T001-U000065,설마 저 얼굴로?,설마 저 얼굴로 ?,설마 저 얼굴로 ?
192.109,193.36,R258-S01-T001-U000066,"[미수의 놀라는 신음](은자)아, 깜짝이야","아 , 깜짝이야","미수의 놀라는 신음 은자 아 , 깜짝이야"
193.652,194.653,R258-S01-T001-U000067,[은자의 당황하는 신음],,은자의 당황하는 신음
198.824,200.659,R258-S01-T001-U000068,[탁탁 소리가 들린다],,탁탁 소리가 들린다
205.789,208.125,R258-S01-T001-U000069,[학교가 시끌벅적하다],,학교가 시끌벅적하다
231.398,232.441,R258-S01-T001-U000070,[학생들의 짜증 섞인 신음],,학생들의 짜증 섞인 신음
232.524,233.859,R258-S01-T001-U000071,(선생1)빨리 안 뛰냐?,빨리 안 뛰냐 ?,선생 빨리 안 뛰냐 ?
235.902,237.195,R258-S01-T001-U000072,[멀리서 개가 멍멍 짖는다],,멀리서 개가 멍멍 짖는다
238.196,240.824,R258-S01-T001-U000073,"(은자)언니! 어머니도 계셨네, 안녕하세요","언니 ! 어머니도 계셨네 , 안녕하세요","은자 언니 ! 어머니도 계셨네 , 안녕하세요"
240.907,242.075,R258-S01-T001-U000074,"- (손님1) 여기요- 네, 감사합니다","여기요 네 , 감사합니다","손님 여기요 네 , 감사합니다"
242.159,243.994,R258-S01-T001-U000075,[돈통을 드르르 여닫는다](손님1)수고하세요,수고하세요,돈통을 드르르 여닫는다 손님 수고하세요
244.077,245.495,R258-S01-T001-U000076,[잔잔한 음악이 흘러나온다][미수의 난감한 숨소리],,잔잔한 음악이 흘러나온다 미수의 난감한 숨소리
246.538,248.373,R258-S01-T001-U000077,- 다음에 또 오세요- (손님1) 네,다음에 또 오세요 네,다음에 또 오세요 손님 네
249.374,252.752,R258-S01-T001-U000078,(은자)너 내가 시험이라고 오지 말라고...,너 내가 시험이라고 오지 말라고 . . .,은자 너 내가 시험이라고 오지 말라고 . . .
255.505,256.59,R258-S01-T001-U000079,[현우의 한숨][은자의 의아한 신음],,현우의 한숨 은자의 의아한 신음
257.883,259.05,R258-S01-T001-U000080,(현우)열심히 할게요,열심히 할게요,현우 열심히 할게요
259.259,261.136,R258-S01-T001-U000081,(은자)쟤 뭐야?,쟤 뭐야 ?,은자 쟤 뭐야 ?
261.428,262.637,R258-S01-T001-U000082,(현우)이거 옮기면 되죠?,이거 옮기면 되죠 ?,현우 이거 옮기면 되죠 ?
263.263,266.224,R258-S01-T001-U000083,"- (은자) 어, 어, 너 빨리...- (미수) 언니는 옷 갈아입어","어 , 어 , 너 빨리 . . . 언니는 옷 갈아입어","은자 어 , 어 , 너 빨리 . . . 미수 언니는 옷 갈아입어"
266.516,268.185,R258-S01-T001-U000084,"(미수)내가 할게, 너 학교 가","내가 할게 , 너 학교 가","미수 내가 할게 , 너 학교 가"
268.477,270.395,R258-S01-T001-U000085,(현우)학교 저 안 가요,학교 저 안 가요,현우 학교 저 안 가요
271.188,274.232,R258-S01-T001-U000086,두 분은 각자 알아서 할 일 하세요,두 분은 각자 알아서 할 일 하세요,두 분은 각자 알아서 할 일 하세요
277.235,280.322,R258-S01-T001-U000087,"(은자)야, 너 왜 학교 안 가?","야 , 너 왜 학교 안 가 ?","은자 야 , 너 왜 학교 안 가 ?"
283.45,284.659,R258-S01-T001-U000088,그만뒀어요,그만뒀어요,그만뒀어요
285.869,286.87,R258-S01-T001-U000089,[문발이 잘그락거린다],,문발이 잘그락거린다
287.788,288.955,R258-S01-T001-U000090,[현우가 포대를 바스락 든다],,현우가 포대를 바스락 든다
289.331,293.084,R258-S01-T001-U000091,(미수)너 진짜 갔다 온 거야?,너 진짜 갔다 온 거야 ?,미수 너 진짜 갔다 온 거야 ?
293.835,294.711,R258-S01-T001-U000092,(현우)어딜요?,어딜요 ?,현우 어딜요 ?
296.129,297.047,R258-S01-T001-U000093,(미수)감방,감방,미수 감방
298.173,299.8,R258-S01-T001-U000094,별로 말하고 싶지 않은데,별로 말하고 싶지 않은데,별로 말하고 싶지 않은데
302.01,302.969,R258-S01-T001-U000095,[은자가 피식한다],,은자가 피식한다
307.808,310.477,R258-S01-T001-U000096,"그래, 그러든가","그래 , 그러든가","그래 , 그러든가"
314.231,315.106,R258-S01-T001-U000097,(은자)음,음,은자 음
320.654,321.613,R258-S01-T001-U000098,[현우가 포대를 탁 내려놓는다],,현우가 포대를 탁 내려놓는다
322.03,324.157,R258-S01-T001-U000099,[라디오에서 밝은 음악이 흘러나온다][새가 지저귄다],,라디오에서 밝은 음악이 흘러나온다 새가 지저귄다
334.334,335.418,R258-S01-T001-U000100,"야, 두부","야 , 두부","야 , 두부"
336.586,339.714,R258-S01-T001-U000101,(은자)너 거기 감방 얘기 좀 해 봐,너 거기 감방 얘기 좀 해 봐,은자 너 거기 감방 얘기 좀 해 봐
340.173,341.341,R258-S01-T001-U000102,[미수의 만류하는 숨소리][은자의 옅은 신음],,미수의 만류하는 숨소리 은자의 옅은 신음
342.384,343.885,R258-S01-T001-U000103,[숨을 들이켠다],,숨을 들이켠다
344.01,346.721,R258-S01-T001-U000104,"(은자)그래, 그러든가","그래 , 그러든가","은자 그래 , 그러든가"
352.978,354.646,R258-S01-T001-U000105,두 분 가족 아니죠?,두 분 가족 아니죠 ?,두 분 가족 아니죠 ?
358.441,360.068,R258-S01-T001-U000106,말 안 해 줄 거지롱,말 안 해 줄 거지롱,말 안 해 줄 거지롱
360.235,361.82,R258-S01-T001-U000107,[은자가 살짝 웃는다],,은자가 살짝 웃는다
362.487,364.406,R258-S01-T001-U000108,"(은자)우리 안 닮긴 했나 봐, 그렇지?","우리 안 닮긴 했나 봐 , 그렇지 ?","은자 우리 안 닮긴 했나 봐 , 그렇지 ?"
364.489,365.407,R258-S01-T001-U000109,[미수가 살짝 웃는다],,미수가 살짝 웃는다
368.743,371.58,R258-S01-T001-U000110,(미수)언니 열여덟 살 때인가,언니 열여덟 살 때인가,미수 언니 열여덟 살 때인가
